{
  "contract": "earlysignal-data-v1",
  "generated_at": "2026-10-09T03:49:15.394453+00:00",
  "data_source": {
    "name": "NHTSA ODI complaints & investigations",
    "downloaded_at": null,
    "observed_local_date": "2026-10-09",
    "license": "public domain"
  },
  "params": {
    "rule": "poisson",
    "alpha": 0.001,
    "min_count": 3,
    "baseline_months": 12,
    "min_history": 6,
    "lambda_floor": 0.5,
    "pre_window_months": 12,
    "evaluation_window_basis": "alert_month"
  },
  "validation": {
    "dev": {
      "case": {
        "hits": 9,
        "n": 19
      },
      "control": {
        "hits": 0,
        "n": 19
      }
    },
    "holdout": {
      "case": {
        "hits": 7,
        "n": 19
      },
      "control": {
        "hits": 1,
        "n": 17
      }
    }
  },
  "burden": {
    "case_alerts_per_group_month": 0.19932049830124576,
    "control_alerts_per_group_month": 0.09230769230769231
  },
  "labels": {
    "llm_model": "gpt-4.1-mini-2025-04-14",
    "llm_labeled": 7502,
    "sample_agreement": {
      "agree": 27,
      "n": 60
    },
    "human_check": {
      "n": 0,
      "kw_correct": null,
      "llm_correct": null
    },
    "cost_per_1k_usd": null
  },
  "validation_notes": [
    "접수일 기준 회고적 분석이며 당시 파일 공개·수정 이력은 복원하지 않았습니다.",
    "사전 dev 8/19와 현재 9/19는 다릅니다. 기존 키워드 코드가 제공되지 않아 완전 동일성은 미확인입니다.",
    "holdout 결과를 보고 탐지 임계값이나 키워드를 바꾸지 않았습니다.",
    "볼트 EV는 현재 키워드 기준 놓친 사례입니다. 사전 시제품의 late 결과와 다릅니다.",
    "검토 업무량은 등록 평가창의 그룹월을 합산한 관측치이며 현업 업무량은 미검증입니다.",
    "38사례·36대조 주 검증과 검토 업무량은 키워드 기준선입니다. 콘솔의 LLM은 전체 demo를 사용합니다. 독립 30건 사람 검수는 자료 준비 후 도메인 지식·공모전 시간 제약으로 완료하지 못했으며, 분류 정확도는 미측정입니다. 전문가 검수는 후속 과제입니다."
  ]
}
